{
  "title": "Runtime rendering audit",
  "summary": "Runtime mode is explicit, pinned, and still keeps evidence readable.",
  "status": "review",
  "template": "research-explainer",
  "renderMode": "runtime",
  "generatedAt": "2026-05-13T00:00:00.000Z",
  "sections": [
    {
      "type": "markdown",
      "title": "Runtime markdown",
      "content": "## Runtime source\n\n- Marked parses Markdown\n- DOMPurify sanitizes untrusted HTML\n\n| Runtime | Version |\n| --- | --- |\n| marked | 18.0.3 |"
    },
    {
      "type": "mermaid",
      "title": "Runtime diagram",
      "content": "graph TD\n  Source --> Runtime\n  Runtime --> Fallback"
    },
    {
      "type": "code",
      "title": "Runtime code",
      "filePath": ".agents/skills/html-work-reports/assets/components/rich-render-runtime.js",
      "language": "javascript",
      "highlightLines": [2],
      "content": "window.HTMLWorkReportsRichRender = {\n  renderAll\n};"
    }
  ],
  "evidence": [
    {
      "kind": "source",
      "label": "Runtime pins",
      "value": "marked@18.0.3, DOMPurify@3.4.2, mermaid@11.15.0, @highlightjs/cdn-assets@11.11.1",
      "status": "info"
    },
    {
      "kind": "verification",
      "label": "Fallbacks",
      "value": "Each rich section keeps source text for auditing.",
      "status": "pass"
    }
  ],
  "verification": [
    {
      "label": "Runtime dependencies declared",
      "status": "pass",
      "detail": "Pinned versions appear in the report metadata."
    }
  ],
  "nextActions": [
    "Use runtime mode only for live editing or post-load conversion."
  ]
}
